
TKPROF: Release 23.0.0.0.0 - Development on Sat Aug 8 01:03:09 2026

Copyright (c) 1982, 2025, Oracle and/or its affiliates.  All rights reserved.

Trace file: ./FREE_ora_702.trc
Trace file version:
   Oracle Database 23ai Free Release 23.0.0.0.0 - Develop, Learn, and Run for Free
   Version 23.9.0.25.07
   Build label:    RDBMS_23.9.0.25.07DBRU_LINUX.X64_250723.FREE
Sort options: default

********************************************************************************
count    = number of times OCI procedure was executed
cpu      = cpu time in seconds executing 
elapsed  = elapsed time in seconds executing
disk     = number of physical reads of buffers from disk
query    = number of buffers gotten for consistent read
current  = number of buffers gotten in current mode (usually for update)
rows     = number of rows processed by the fetch or execute call
********************************************************************************

SQL ID: 0k8522rmdzg4k Plan Hash: 2057665657

select privilege# 
from
 sysauth$ where (grantee#=:1 or grantee#=1) and privilege#>0


call     count       cpu    elapsed       disk      query    current        rows
------- ------  -------- ---------- ---------- ---------- ----------  ----------
Parse        1      0.00       0.00          0          0          0           0
Execute      1      0.00       0.00          0          0          0           0
Fetch        4      0.00       0.00          0          7          0           3
------- ------  -------- ---------- ---------- ---------- ----------  ----------
total        6      0.00       0.00          0          7          0           3

Misses in library cache during parse: 0
Optimizer mode: CHOOSE
Parsing user id: SYS   (recursive depth: 1)
Number of plan statistics captured: 1

Rows (1st) Rows (avg) Rows (max)  Row Source Operation
---------- ---------- ----------  ---------------------------------------------------
         3          3          3  INLIST ITERATOR  (cr=7 pr=0 pw=0 time=197 us starts=1 direct read=0 direct write=0)
         3          3          3   INDEX RANGE SCAN I_SYSAUTH1 (cr=7 pr=0 pw=0 time=169 us starts=2 direct read=0 direct write=0 cost=2 size=24 card=3)(object id 153)

********************************************************************************

SQL ID: 5dqz0hqtp9fru Plan Hash: 1227530427

select /*+ connect_by_filtering index(sysauth$ i_sysauth1) */ privilege#, 
  bitand(nvl(option$, 0), 72), grantee#, level 
from
 sysauth$ connect by grantee#=prior privilege# and privilege#>0 start with 
  grantee#=:1 and privilege#>0


call     count       cpu    elapsed       disk      query    current        rows
------- ------  -------- ---------- ---------- ---------- ----------  ----------
Parse        3      0.00       0.00          0          0          0           0
Execute      3      0.00       0.00          0          0          0           0
Fetch       48      0.00       0.00          0         39          0          45
------- ------  -------- ---------- ---------- ---------- ----------  ----------
total       54      0.00       0.00          0         39          0          45

Misses in library cache during parse: 0
Optimizer mode: CHOOSE
Parsing user id: SYS   (recursive depth: 1)
Number of plan statistics captured: 1

Rows (1st) Rows (avg) Rows (max)  Row Source Operation
---------- ---------- ----------  ---------------------------------------------------
         0          0          0  CONNECT BY WITH FILTERING (cr=2 pr=0 pw=0 time=68 us starts=1 direct read=0 direct write=0)
         0          0          0   TABLE ACCESS BY INDEX ROWID BATCHED SYSAUTH$ (cr=2 pr=0 pw=0 time=31 us starts=1 direct read=0 direct write=0 cost=3 size=33 card=3)
         0          0          0    INDEX RANGE SCAN I_SYSAUTH1 (cr=2 pr=0 pw=0 time=19 us starts=1 direct read=0 direct write=0 cost=2 size=0 card=3)(object id 153)
         0          0          0   HASH JOIN  (cr=0 pr=0 pw=0 time=0 us starts=0 direct read=0 direct write=0 cost=9 size=192 card=8)
         0          0          0    NESTED LOOPS  (cr=0 pr=0 pw=0 time=0 us starts=0 direct read=0 direct write=0 cost=9 size=192 card=8)
         0          0          0     STATISTICS COLLECTOR  (cr=0 pr=0 pw=0 time=0 us starts=0 direct read=0 direct write=0)
         0          0          0      CONNECT BY PUMP  (cr=0 pr=0 pw=0 time=0 us starts=0 direct read=0 direct write=0)
         0          0          0     TABLE ACCESS BY INDEX ROWID BATCHED SYSAUTH$ (cr=0 pr=0 pw=0 time=0 us starts=0 direct read=0 direct write=0 cost=2 size=33 card=3)
         0          0          0      INDEX RANGE SCAN I_SYSAUTH1 (cr=0 pr=0 pw=0 time=0 us starts=0 direct read=0 direct write=0 cost=1 size=0 card=3)(object id 153)
         0          0          0    TABLE ACCESS BY INDEX ROWID BATCHED SYSAUTH$ (cr=0 pr=0 pw=0 time=0 us starts=0 direct read=0 direct write=0 cost=2 size=33 card=3)
         0          0          0     INDEX FULL SCAN I_SYSAUTH1 (cr=0 pr=0 pw=0 time=0 us starts=0 direct read=0 direct write=0 cost=1 size=0 card=3)(object id 153)


Elapsed times include waiting on following events:
  Event waited on                             Times   Max. Wait  Total Waited
  ----------------------------------------   Waited  ----------  ------------
  Allocate UGA memory from OS                     3        0.00          0.00
********************************************************************************

SQL ID: 9mb61uqwwqkpj Plan Hash: 2709293936

select spare6 
from
 sys.user$ where user#=:1


call     count       cpu    elapsed       disk      query    current        rows
------- ------  -------- ---------- ---------- ---------- ----------  ----------
Parse        1      0.00       0.00          0          0          0           0
Execute      1      0.00       0.00          0          0          0           0
Fetch        1      0.00       0.00          0          2          0           1
------- ------  -------- ---------- ---------- ---------- ----------  ----------
total        3      0.00       0.00          0          2          0           1

Misses in library cache during parse: 0
Optimizer mode: CHOOSE
Parsing user id: SYS   (recursive depth: 1)
Number of plan statistics captured: 1

Rows (1st) Rows (avg) Rows (max)  Row Source Operation
---------- ---------- ----------  ---------------------------------------------------
         1          1          1  TABLE ACCESS CLUSTER USER$ (cr=2 pr=0 pw=0 time=97 us starts=1 direct read=0 direct write=0 cost=1 size=6 card=1)
         1          1          1   INDEX UNIQUE SCAN I_USER# (cr=1 pr=0 pw=0 time=40 us starts=1 direct read=0 direct write=0 cost=0 size=0 card=1)(object id 11)

********************************************************************************

SQL ID: 9w9np2sc9ss7t Plan Hash: 0

ALTER SESSION SET TIME_ZONE='+01:00'


call     count       cpu    elapsed       disk      query    current        rows
------- ------  -------- ---------- ---------- ---------- ----------  ----------
Parse        1      0.00       0.00          0          0          0           0
Execute      1      0.00       0.00          0          0          0           0
Fetch        0      0.00       0.00          0          0          0           0
------- ------  -------- ---------- ---------- ---------- ----------  ----------
total        2      0.00       0.00          0          0          0           0

Misses in library cache during parse: 0
Parsing user id: 137     (recursive depth: 1)
********************************************************************************

SQL ID: 8btyg0wy808ch Plan Hash: 2447725225

update sys.user$ set spare1=spare1-BITAND(spare1, 1048576), spare6=
  DECODE(to_char(:2, 'YYYY-MM-DD'), '0000-00-00', to_date(NULL), :2) 
where
 user#=:1


call     count       cpu    elapsed       disk      query    current        rows
------- ------  -------- ---------- ---------- ---------- ----------  ----------
Parse        1      0.00       0.00          0          0          0           0
Execute      1      0.00       0.00          0          2          2           1
Fetch        0      0.00       0.00          0          0          0           0
------- ------  -------- ---------- ---------- ---------- ----------  ----------
total        2      0.00       0.00          0          2          2           1

Misses in library cache during parse: 0
Optimizer mode: CHOOSE
Parsing user id: SYS   (recursive depth: 1)
Number of plan statistics captured: 1

Rows (1st) Rows (avg) Rows (max)  Row Source Operation
---------- ---------- ----------  ---------------------------------------------------
         0          0          0  UPDATE  USER$ (cr=2 pr=0 pw=0 time=290 us starts=1 direct read=0 direct write=0)
         1          1          1   TABLE ACCESS CLUSTER USER$ (cr=2 pr=0 pw=0 time=16 us starts=1 direct read=0 direct write=0 cost=1 size=27 card=1)
         1          1          1    INDEX UNIQUE SCAN I_USER# (cr=1 pr=0 pw=0 time=6 us starts=1 direct read=0 direct write=0 cost=0 size=0 card=1)(object id 11)

********************************************************************************

SQL ID: f0h5rpzmhju11 Plan Hash: 4175978637

select SYS_CONTEXT('USERENV', 'SERVER_HOST'), SYS_CONTEXT('USERENV', 
  'DB_UNIQUE_NAME'), SYS_CONTEXT('USERENV', 'INSTANCE_NAME'), 
  SYS_CONTEXT('USERENV', 'INSTANCE'), STARTUP_TIME, SYS_CONTEXT('USERENV', 
  'DB_DOMAIN'), SYS_CONTEXT('USERENV', 'SERVICE_NAME')  
from
 v$instance


call     count       cpu    elapsed       disk      query    current        rows
------- ------  -------- ---------- ---------- ---------- ----------  ----------
Parse        1      0.00       0.00          0          0          0           0
Execute      1      0.00       0.00          0          0          0           0
Fetch        1      0.00       0.00          0          0          0           1
------- ------  -------- ---------- ---------- ---------- ----------  ----------
total        3      0.00       0.00          0          0          0           1

Misses in library cache during parse: 0
Optimizer mode: CHOOSE
Parsing user id: SYS   (recursive depth: 1)
Number of plan statistics captured: 1

Rows (1st) Rows (avg) Rows (max)  Row Source Operation
---------- ---------- ----------  ---------------------------------------------------
         1          1          1  MERGE JOIN CARTESIAN (cr=0 pr=0 pw=0 time=89 us starts=1 direct read=0 direct write=0 cost=0 size=24 card=1)
         1          1          1   MERGE JOIN CARTESIAN (cr=0 pr=0 pw=0 time=72 us starts=1 direct read=0 direct write=0 cost=0 size=13 card=1)
         1          1          1    MERGE JOIN CARTESIAN (cr=0 pr=0 pw=0 time=50 us starts=1 direct read=0 direct write=0 cost=0 size=0 card=1)
         1          1          1     FIXED TABLE FULL X$QUIESCE (cr=0 pr=0 pw=0 time=29 us starts=1 direct read=0 direct write=0 cost=0 size=0 card=1)
         1          1          1     BUFFER SORT (cr=0 pr=0 pw=0 time=15 us starts=1 direct read=0 direct write=0 cost=0 size=0 card=1)
         1          1          1      FIXED TABLE FULL X$KJIDT (cr=0 pr=0 pw=0 time=11 us starts=1 direct read=0 direct write=0 cost=0 size=0 card=1)
         1          1          1    BUFFER SORT (cr=0 pr=0 pw=0 time=21 us starts=1 direct read=0 direct write=0 cost=0 size=13 card=1)
         1          1          1     FIXED TABLE FULL X$KSUXSINST (cr=0 pr=0 pw=0 time=20 us starts=1 direct read=0 direct write=0 cost=0 size=13 card=1)
         1          1          1   BUFFER SORT (cr=0 pr=0 pw=0 time=11 us starts=1 direct read=0 direct write=0 cost=0 size=11 card=1)
         1          1          1    FIXED TABLE FULL X$KVIT (cr=0 pr=0 pw=0 time=10 us starts=1 direct read=0 direct write=0 cost=0 size=11 card=1)

********************************************************************************

SQL ID: bs49gudrrb053 Plan Hash: 395742348

select decode(upper(failover_method), NULL, 0 , 'BASIC', 1, 'PRECONNECT', 2 , 
  'PREPARSE', 4 , 0), decode(upper(failover_type), NULL, 1,  'NONE', 1, 
  'SESSION', 2, 'SELECT',  4, 'TRANSACTION',  8, 'AUTO' , 32,  1 ), 
  failover_retries, failover_delay, flags, nvl(replay_initiation_timeout, 900)
  , decode(upper(session_state_consistency), 'STATIC', 16, 'HYBRID', 256,  0),
   failover_restore 
from
 sys.service$ where name = :1


call     count       cpu    elapsed       disk      query    current        rows
------- ------  -------- ---------- ---------- ---------- ----------  ----------
Parse        1      0.00       0.00          0          0          0           0
Execute      1      0.00       0.00          0          0          0           0
Fetch        1      0.00       0.00          0          2          0           0
------- ------  -------- ---------- ---------- ---------- ----------  ----------
total        3      0.00       0.00          0          2          0           0

Misses in library cache during parse: 0
Optimizer mode: CHOOSE
Parsing user id: SYS   (recursive depth: 1)
Number of plan statistics captured: 1

Rows (1st) Rows (avg) Rows (max)  Row Source Operation
---------- ---------- ----------  ---------------------------------------------------
         0          0          0  TABLE ACCESS FULL SERVICE$ (cr=2 pr=0 pw=0 time=71 us starts=1 direct read=0 direct write=0 cost=2 size=59 card=1)

********************************************************************************

SQL ID: 974jahtujp6cj Plan Hash: 0

ALTER SESSION SET NLS_DATE_FORMAT = 'YYYY-MM-DD HH24:MI:SS'


call     count       cpu    elapsed       disk      query    current        rows
------- ------  -------- ---------- ---------- ---------- ----------  ----------
Parse        1      0.00       0.00          0          0          0           0
Execute      1      0.00       0.00          0          0          0           0
Fetch        0      0.00       0.00          0          0          0           0
------- ------  -------- ---------- ---------- ---------- ----------  ----------
total        2      0.00       0.00          0          0          0           0

Misses in library cache during parse: 0
Parsing user id: 137  

Elapsed times include waiting on following events:
  Event waited on                             Times   Max. Wait  Total Waited
  ----------------------------------------   Waited  ----------  ------------
  SQL*Net message to client                       1        0.00          0.00
  SQL*Net message from client                     1        0.00          0.00
********************************************************************************

SQL ID: 0bh1s0gu171kz Plan Hash: 0

ALTER SESSION SET NLS_LANGUAGE = 'AMERICAN' NLS_TERRITORY = 'AMERICA'


call     count       cpu    elapsed       disk      query    current        rows
------- ------  -------- ---------- ---------- ---------- ----------  ----------
Parse        1      0.00       0.00          0          0          0           0
Execute      1      0.00       0.00          0          0          0           0
Fetch        0      0.00       0.00          0          0          0           0
------- ------  -------- ---------- ---------- ---------- ----------  ----------
total        2      0.00       0.00          0          0          0           0

Misses in library cache during parse: 0
Parsing user id: 137  

Elapsed times include waiting on following events:
  Event waited on                             Times   Max. Wait  Total Waited
  ----------------------------------------   Waited  ----------  ------------
  SQL*Net message to client                       1        0.00          0.00
  SQL*Net message from client                     1        0.00          0.00
********************************************************************************

SQL ID: 0k69mvhw5r4f4 Plan Hash: 0

ALTER SESSION SET TIME_ZONE = 'UTC'


call     count       cpu    elapsed       disk      query    current        rows
------- ------  -------- ---------- ---------- ---------- ----------  ----------
Parse        1      0.00       0.00          0          0          0           0
Execute      1      0.00       0.00          0          0          0           0
Fetch        0      0.00       0.00          0          0          0           0
------- ------  -------- ---------- ---------- ---------- ----------  ----------
total        2      0.00       0.00          0          0          0           0

Misses in library cache during parse: 0
Parsing user id: 137  

Elapsed times include waiting on following events:
  Event waited on                             Times   Max. Wait  Total Waited
  ----------------------------------------   Waited  ----------  ------------
  SQL*Net message to client                       1        0.00          0.00
  SQL*Net message from client                     1        0.00          0.00
********************************************************************************

SQL ID: fhnd2n0dmwg8z Plan Hash: 0

BEGIN DATA_MANAGER.GET_FIELD_ROWS(:P_MIN_NUM, :P_RESULTS); END;


call     count       cpu    elapsed       disk      query    current        rows
------- ------  -------- ---------- ---------- ---------- ----------  ----------
Parse        2      0.00       0.00          0          0          0           0
Execute      2      0.00       0.00          0          0          0           2
Fetch        0      0.00       0.00          0          0          0           0
------- ------  -------- ---------- ---------- ---------- ----------  ----------
total        4      0.00       0.00          0          0          0           2

Misses in library cache during parse: 0
Optimizer mode: ALL_ROWS
Parsing user id: 137  

Elapsed times include waiting on following events:
  Event waited on                             Times   Max. Wait  Total Waited
  ----------------------------------------   Waited  ----------  ------------
  SQL*Net message to client                       2        0.00          0.00
  SQL*Net message from client                     2        0.00          0.00
********************************************************************************

SQL ID: 0n0wwqagr61ua Plan Hash: 1411535462

SELECT NUMBER_COL, VARCHAR2_COL, DATE_COL 
FROM
 DATA_MANAGER.OCI_FIELD_TEST WHERE NUMBER_COL >= :B1 ORDER BY NUMBER_COL


call     count       cpu    elapsed       disk      query    current        rows
------- ------  -------- ---------- ---------- ---------- ----------  ----------
Parse        2      0.00       0.00          0          0          0           0
Execute      2      0.00       0.00          0          0          0           0
Fetch       75      0.00       0.00          0        733          0         371
------- ------  -------- ---------- ---------- ---------- ----------  ----------
total       79      0.00       0.00          0        733          0         371

Misses in library cache during parse: 0
Optimizer mode: ALL_ROWS
Parsing user id: 137  
Number of plan statistics captured: 1

Rows (1st) Rows (avg) Rows (max)  Row Source Operation
---------- ---------- ----------  ---------------------------------------------------
       182        182        182  SORT ORDER BY (cr=416 pr=0 pw=0 time=1116 us starts=1 direct read=0 direct write=0 cost=6 size=1032 card=86)
       182        182        182   TABLE ACCESS FULL OCI_FIELD_TEST (cr=416 pr=0 pw=0 time=1295 us starts=1 direct read=0 direct write=0 cost=5 size=1032 card=86)


Elapsed times include waiting on following events:
  Event waited on                             Times   Max. Wait  Total Waited
  ----------------------------------------   Waited  ----------  ------------
  Allocate UGA memory from OS                     1        0.00          0.00
  SQL*Net message to client                      75        0.00          0.00
  SQL*Net message from client                    75        0.00          0.04
********************************************************************************

SQL ID: f265vrzm0q0u1 Plan Hash: 963832190

UPDATE DATA_MANAGER.OCI_FIELD_TEST SET VARCHAR2_COL=:1, BLOB_COL=EMPTY_BLOB() 
WHERE
 NUMBER_COL=:2


call     count       cpu    elapsed       disk      query    current        rows
------- ------  -------- ---------- ---------- ---------- ----------  ----------
Parse        2      0.00       0.00          0          0          0           0
Execute      2      0.00       0.00          0        774          0           0
Fetch        0      0.00       0.00          0          0          0           0
------- ------  -------- ---------- ---------- ---------- ----------  ----------
total        4      0.00       0.00          0        774          0           0

Misses in library cache during parse: 0
Optimizer mode: ALL_ROWS
Parsing user id: 137  
Number of plan statistics captured: 1

Rows (1st) Rows (avg) Rows (max)  Row Source Operation
---------- ---------- ----------  ---------------------------------------------------
         0          0          0  UPDATE  OCI_FIELD_TEST (cr=416 pr=0 pw=0 time=451 us starts=1 direct read=0 direct write=0)
         0          0          0   TABLE ACCESS FULL OCI_FIELD_TEST (cr=416 pr=0 pw=0 time=448 us starts=1 direct read=0 direct write=0 cost=5 size=104 card=2)


Elapsed times include waiting on following events:
  Event waited on                             Times   Max. Wait  Total Waited
  ----------------------------------------   Waited  ----------  ------------
  Allocate UGA memory from OS                     3        0.00          0.00
  SQL*Net message to client                       2        0.00          0.00
  SQL*Net message from client                     2        0.00          0.00
********************************************************************************

SQL ID: 2y6ngqfkjgfj2 Plan Hash: 3474980505

SELECT BLOB_COL 
FROM
 DATA_MANAGER.OCI_FIELD_TEST WHERE ROWID = :rid FOR UPDATE


call     count       cpu    elapsed       disk      query    current        rows
------- ------  -------- ---------- ---------- ---------- ----------  ----------
Parse        5      0.00       0.00          0          0          0           0
Execute      5      0.00       0.00          0         25          1           0
Fetch        1      0.00       0.00          0         48          0           1
------- ------  -------- ---------- ---------- ---------- ----------  ----------
total       11      0.00       0.00          0         73          1           1

Misses in library cache during parse: 0
Optimizer mode: ALL_ROWS
Parsing user id: 137  
Number of plan statistics captured: 1

Rows (1st) Rows (avg) Rows (max)  Row Source Operation
---------- ---------- ----------  ---------------------------------------------------
         0          0          0  FOR UPDATE  (cr=0 pr=0 pw=0 time=0 us starts=1 direct read=0 direct write=0)
         0          0          0   TABLE ACCESS BY USER ROWID OCI_FIELD_TEST (cr=0 pr=0 pw=0 time=0 us starts=1 direct read=0 direct write=0 cost=1 size=52 card=1)


Elapsed times include waiting on following events:
  Event waited on                             Times   Max. Wait  Total Waited
  ----------------------------------------   Waited  ----------  ------------
  SQL*Net break/reset to client                   8        0.00          0.00
  SQL*Net message from client                     6        0.00          0.00
  SQL*Net message to client                       2        0.00          0.00
********************************************************************************

SQL ID: 63vbmwbg199cv Plan Hash: 0

INSERT INTO DATA_MANAGER.OCI_FIELD_TEST (NUMBER_COL, CLOB_COL) 
VALUES
 (:1, EMPTY_CLOB())


call     count       cpu    elapsed       disk      query    current        rows
------- ------  -------- ---------- ---------- ---------- ----------  ----------
Parse        2      0.00       0.00          0          0          0           0
Execute      2      0.00       0.00          0          1          7           2
Fetch        0      0.00       0.00          0          0          0           0
------- ------  -------- ---------- ---------- ---------- ----------  ----------
total        4      0.00       0.00          0          1          7           2

Misses in library cache during parse: 0
Optimizer mode: ALL_ROWS
Parsing user id: 137  
Number of plan statistics captured: 1

Rows (1st) Rows (avg) Rows (max)  Row Source Operation
---------- ---------- ----------  ---------------------------------------------------
         0          0          0  LOAD TABLE CONVENTIONAL  OCI_FIELD_TEST (cr=1 pr=0 pw=0 time=254 us starts=1 direct read=0 direct write=0)


Elapsed times include waiting on following events:
  Event waited on                             Times   Max. Wait  Total Waited
  ----------------------------------------   Waited  ----------  ------------
  SQL*Net message to client                       2        0.00          0.00
  SQL*Net message from client                     2        0.00          0.00
********************************************************************************

SQL ID: ap0n716ahz91u Plan Hash: 3474980505

SELECT CLOB_COL 
FROM
 DATA_MANAGER.OCI_FIELD_TEST WHERE ROWID = :rid FOR UPDATE


call     count       cpu    elapsed       disk      query    current        rows
------- ------  -------- ---------- ---------- ---------- ----------  ----------
Parse        2      0.00       0.00          0          0          0           0
Execute      2      0.00       0.00          0         80          2           0
Fetch        2      0.00       0.00          0        154          0           2
------- ------  -------- ---------- ---------- ---------- ----------  ----------
total        6      0.00       0.00          0        234          2           2

Misses in library cache during parse: 0
Optimizer mode: ALL_ROWS
Parsing user id: 137  
Number of plan statistics captured: 1

Rows (1st) Rows (avg) Rows (max)  Row Source Operation
---------- ---------- ----------  ---------------------------------------------------
         1          1          1  FOR UPDATE  (cr=77 pr=0 pw=0 time=220 us starts=1 direct read=0 direct write=0)
         2          2          2   TABLE ACCESS BY USER ROWID OCI_FIELD_TEST (cr=77 pr=0 pw=0 time=210 us starts=2 direct read=0 direct write=0 cost=1 size=46 card=1)


Elapsed times include waiting on following events:
  Event waited on                             Times   Max. Wait  Total Waited
  ----------------------------------------   Waited  ----------  ------------
  SQL*Net message to client                       4        0.00          0.00
  SQL*Net message from client                     4        0.00          0.00
********************************************************************************

SQL ID: 7pc4g8k0xm9tn Plan Hash: 1433888574

DELETE FROM DATA_MANAGER.OCI_FIELD_TEST 
WHERE
 NUMBER_COL=:1


call     count       cpu    elapsed       disk      query    current        rows
------- ------  -------- ---------- ---------- ---------- ----------  ----------
Parse        1      0.00       0.00          0          0          0           0
Execute      1      0.00       0.00          0        429          0           0
Fetch        0      0.00       0.00          0          0          0           0
------- ------  -------- ---------- ---------- ---------- ----------  ----------
total        2      0.00       0.00          0        429          0           0

Misses in library cache during parse: 0
Optimizer mode: ALL_ROWS
Parsing user id: 137  
Number of plan statistics captured: 1

Rows (1st) Rows (avg) Rows (max)  Row Source Operation
---------- ---------- ----------  ---------------------------------------------------
         0          0          0  DELETE  OCI_FIELD_TEST (cr=429 pr=0 pw=0 time=994 us starts=1 direct read=0 direct write=0)
         0          0          0   TABLE ACCESS FULL OCI_FIELD_TEST (cr=429 pr=0 pw=0 time=990 us starts=1 direct read=0 direct write=0 cost=5 size=12 card=4)


Elapsed times include waiting on following events:
  Event waited on                             Times   Max. Wait  Total Waited
  ----------------------------------------   Waited  ----------  ------------
  Allocate UGA memory from OS                     1        0.00          0.00
  Allocate PGA memory from OS                     1        0.00          0.00
  SQL*Net message to client                       1        0.00          0.00
  SQL*Net message from client                     1        0.00          0.00
********************************************************************************

SQL ID: d11jmbjhb1g8v Plan Hash: 1388734953

SELECT TO_CHAR(TO_DATE(:1,:2),:3) 
FROM
 DUAL


call     count       cpu    elapsed       disk      query    current        rows
------- ------  -------- ---------- ---------- ---------- ----------  ----------
Parse        6      0.00       0.00          0          0          0           0
Execute      6      0.00       0.00          0          0          0           0
Fetch        6      0.00       0.00          0          0          0           6
------- ------  -------- ---------- ---------- ---------- ----------  ----------
total       18      0.00       0.00          0          0          0           6

Misses in library cache during parse: 0
Optimizer mode: ALL_ROWS
Parsing user id: 137  
Number of plan statistics captured: 1

Rows (1st) Rows (avg) Rows (max)  Row Source Operation
---------- ---------- ----------  ---------------------------------------------------
         1          1          1  FAST DUAL  (cr=0 pr=0 pw=0 time=2 us starts=1 direct read=0 direct write=0 cost=2 size=0 card=1)


Elapsed times include waiting on following events:
  Event waited on                             Times   Max. Wait  Total Waited
  ----------------------------------------   Waited  ----------  ------------
  SQL*Net message to client                       6        0.00          0.00
  SQL*Net message from client                     6        0.00          0.01
********************************************************************************

SQL ID: 7uvk7db2u8umb Plan Hash: 2235054712

SELECT COUNT(*) 
FROM
 (SELECT 1 FROM (SELECT DATE_COL FROM DATA_MANAGER.OCI_FIELD_TEST WHERE 
  DATE_COL = TO_DATE('2026-07-27 00:00:00','YYYY-MM-DD HH24:MI:SS')))


call     count       cpu    elapsed       disk      query    current        rows
------- ------  -------- ---------- ---------- ---------- ----------  ----------
Parse        1      0.00       0.00          0          0          0           0
Execute      1      0.00       0.00          0          0          0           0
Fetch        1      0.00       0.00          0        429          0           1
------- ------  -------- ---------- ---------- ---------- ----------  ----------
total        3      0.00       0.00          0        429          0           1

Misses in library cache during parse: 0
Optimizer mode: ALL_ROWS
Parsing user id: 137  
Number of plan statistics captured: 1

Rows (1st) Rows (avg) Rows (max)  Row Source Operation
---------- ---------- ----------  ---------------------------------------------------
         1          1          1  SORT AGGREGATE (cr=429 pr=0 pw=0 time=534 us starts=1 direct read=0 direct write=0)
         0          0          0   TABLE ACCESS FULL OCI_FIELD_TEST (cr=429 pr=0 pw=0 time=521 us starts=1 direct read=0 direct write=0 cost=5 size=3 card=1)


Elapsed times include waiting on following events:
  Event waited on                             Times   Max. Wait  Total Waited
  ----------------------------------------   Waited  ----------  ------------
  SQL*Net message to client                       1        0.00          0.00
  SQL*Net message from client                     1        0.00          0.00
********************************************************************************

SQL ID: 39qrw8pzhagwq Plan Hash: 1433888574

DELETE FROM DATA_MANAGER.OCI_FIELD_TEST 
WHERE
 DATE_COL=TO_DATE(:1,'YYYY-MM-DD HH24:MI:SS')


call     count       cpu    elapsed       disk      query    current        rows
------- ------  -------- ---------- ---------- ---------- ----------  ----------
Parse        2      0.00       0.00          0          0          0           0
Execute      2      0.00       0.00          0        735          0           0
Fetch        0      0.00       0.00          0          0          0           0
------- ------  -------- ---------- ---------- ---------- ----------  ----------
total        4      0.00       0.00          0        735          0           0

Misses in library cache during parse: 0
Optimizer mode: ALL_ROWS
Parsing user id: 137  
Number of plan statistics captured: 1

Rows (1st) Rows (avg) Rows (max)  Row Source Operation
---------- ---------- ----------  ---------------------------------------------------
         0          0          0  DELETE  OCI_FIELD_TEST (cr=424 pr=0 pw=0 time=923 us starts=1 direct read=0 direct write=0)
         0          0          0   TABLE ACCESS FULL OCI_FIELD_TEST (cr=424 pr=0 pw=0 time=919 us starts=1 direct read=0 direct write=0 cost=5 size=3 card=1)


Elapsed times include waiting on following events:
  Event waited on                             Times   Max. Wait  Total Waited
  ----------------------------------------   Waited  ----------  ------------
  SQL*Net message to client                       2        0.00          0.00
  SQL*Net message from client                     2        0.00          0.01
  buffer busy waits                               1        0.00          0.00
********************************************************************************

SQL ID: 0z6khrs8b03jn Plan Hash: 0

BEGIN DATA_MANAGER.GET_DEPT_STATUS(:P_DEPT_ID, :P_STATUS); END;


call     count       cpu    elapsed       disk      query    current        rows
------- ------  -------- ---------- ---------- ---------- ----------  ----------
Parse        1      0.00       0.00          0          0          0           0
Execute      1      0.00       0.00          0          0          0           1
Fetch        0      0.00       0.00          0          0          0           0
------- ------  -------- ---------- ---------- ---------- ----------  ----------
total        2      0.00       0.00          0          0          0           1

Misses in library cache during parse: 0
Optimizer mode: ALL_ROWS
Parsing user id: 137  

Elapsed times include waiting on following events:
  Event waited on                             Times   Max. Wait  Total Waited
  ----------------------------------------   Waited  ----------  ------------
  SQL*Net message to client                       1        0.00          0.00
  SQL*Net message from client                     1        4.94          4.94
********************************************************************************

SQL ID: 3cb4k0vyg8cf6 Plan Hash: 2235054712

SELECT COUNT(*) 
FROM
 DATA_MANAGER.OCI_FIELD_TEST WHERE NUMBER_COL = :B1 


call     count       cpu    elapsed       disk      query    current        rows
------- ------  -------- ---------- ---------- ---------- ----------  ----------
Parse        1      0.00       0.00          0          0          0           0
Execute      1      0.00       0.00          0          0          0           0
Fetch        1      0.00       0.00          0        430          0           1
------- ------  -------- ---------- ---------- ---------- ----------  ----------
total        3      0.00       0.00          0        430          0           1

Misses in library cache during parse: 0
Optimizer mode: ALL_ROWS
Parsing user id: 137     (recursive depth: 1)
Number of plan statistics captured: 1

Rows (1st) Rows (avg) Rows (max)  Row Source Operation
---------- ---------- ----------  ---------------------------------------------------
         1          1          1  SORT AGGREGATE (cr=430 pr=0 pw=0 time=586 us starts=1 direct read=0 direct write=0)
        35         35         35   TABLE ACCESS FULL OCI_FIELD_TEST (cr=430 pr=0 pw=0 time=465 us starts=1 direct read=0 direct write=0 cost=5 size=21 card=7)

********************************************************************************

SQL ID: 6g0xkynzkddsf Plan Hash: 2235054712

SELECT COUNT(*) 
FROM
 (SELECT 1 FROM (SELECT DATE_COL FROM DATA_MANAGER.OCI_FIELD_TEST WHERE 
  DATE_COL = TO_DATE('2026-08-19 14:30:00','YYYY-MM-DD HH24:MI:SS')))


call     count       cpu    elapsed       disk      query    current        rows
------- ------  -------- ---------- ---------- ---------- ----------  ----------
Parse        1      0.00       0.00          0          0          0           0
Execute      1      0.00       0.00          0          0          0           0
Fetch        1      0.00       0.00          0        307          0           1
------- ------  -------- ---------- ---------- ---------- ----------  ----------
total        3      0.00       0.00          0        307          0           1

Misses in library cache during parse: 0
Optimizer mode: ALL_ROWS
Parsing user id: 137  
Number of plan statistics captured: 1

Rows (1st) Rows (avg) Rows (max)  Row Source Operation
---------- ---------- ----------  ---------------------------------------------------
         1          1          1  SORT AGGREGATE (cr=307 pr=0 pw=0 time=785 us starts=1 direct read=0 direct write=0)
         0          0          0   TABLE ACCESS FULL OCI_FIELD_TEST (cr=307 pr=0 pw=0 time=769 us starts=1 direct read=0 direct write=0 cost=5 size=3 card=1)


Elapsed times include waiting on following events:
  Event waited on                             Times   Max. Wait  Total Waited
  ----------------------------------------   Waited  ----------  ------------
  SQL*Net message to client                       1        0.00          0.00
  SQL*Net message from client                     1        0.00          0.00
********************************************************************************

SQL ID: 1kmryxq2cggjq Plan Hash: 1433888574

DELETE FROM DATA_MANAGER.OCI_FIELD_TEST 
WHERE
 NUMBER_COL=:1 AND VARCHAR2_COL=:2


call     count       cpu    elapsed       disk      query    current        rows
------- ------  -------- ---------- ---------- ---------- ----------  ----------
Parse        1      0.00       0.00          0          0          0           0
Execute      1      0.00       0.00          0        313          1           1
Fetch        0      0.00       0.00          0          0          0           0
------- ------  -------- ---------- ---------- ---------- ----------  ----------
total        2      0.00       0.00          0        313          1           1

Misses in library cache during parse: 0
Optimizer mode: ALL_ROWS
Parsing user id: 137  
Number of plan statistics captured: 1

Rows (1st) Rows (avg) Rows (max)  Row Source Operation
---------- ---------- ----------  ---------------------------------------------------
         0          0          0  DELETE  OCI_FIELD_TEST (cr=313 pr=0 pw=0 time=979 us starts=1 direct read=0 direct write=0)
         1          1          1   TABLE ACCESS FULL OCI_FIELD_TEST (cr=313 pr=0 pw=0 time=720 us starts=1 direct read=0 direct write=0 cost=5 size=9 card=1)


Elapsed times include waiting on following events:
  Event waited on                             Times   Max. Wait  Total Waited
  ----------------------------------------   Waited  ----------  ------------
  Allocate UGA memory from OS                     2        0.00          0.00
  SQL*Net message to client                       1        0.00          0.00
  SQL*Net message from client                     1        0.01          0.01
********************************************************************************

SQL ID: 1bg6g36ghhbhs Plan Hash: 0

BEGIN DATA_MANAGER.PURGE_OLD_ROWS; END;


call     count       cpu    elapsed       disk      query    current        rows
------- ------  -------- ---------- ---------- ---------- ----------  ----------
Parse        1      0.00       0.00          0          0          0           0
Execute      1      0.00       0.00          0          0          0           1
Fetch        0      0.00       0.00          0          0          0           0
------- ------  -------- ---------- ---------- ---------- ----------  ----------
total        2      0.00       0.00          0          0          0           1

Misses in library cache during parse: 0
Optimizer mode: ALL_ROWS
Parsing user id: 137  

Elapsed times include waiting on following events:
  Event waited on                             Times   Max. Wait  Total Waited
  ----------------------------------------   Waited  ----------  ------------
  log file sync                                   1        0.00          0.00
  SQL*Net message to client                       1        0.00          0.00
  SQL*Net message from client                     1        0.00          0.00
********************************************************************************

SQL ID: 81cw8jk1g31qf Plan Hash: 1433888574

DELETE FROM DATA_MANAGER.OCI_FIELD_TEST 
WHERE
 DATE_COL < SYSDATE - 365


call     count       cpu    elapsed       disk      query    current        rows
------- ------  -------- ---------- ---------- ---------- ----------  ----------
Parse        1      0.00       0.00          0          0          0           0
Execute      1      0.00       0.00          0         51          0           0
Fetch        0      0.00       0.00          0          0          0           0
------- ------  -------- ---------- ---------- ---------- ----------  ----------
total        2      0.00       0.00          0         51          0           0

Misses in library cache during parse: 0
Optimizer mode: ALL_ROWS
Parsing user id: 137     (recursive depth: 1)
Number of plan statistics captured: 1

Rows (1st) Rows (avg) Rows (max)  Row Source Operation
---------- ---------- ----------  ---------------------------------------------------
         0          0          0  DELETE  OCI_FIELD_TEST (cr=51 pr=0 pw=0 time=223 us starts=1 direct read=0 direct write=0)
         0          0          0   TABLE ACCESS FULL OCI_FIELD_TEST (cr=51 pr=0 pw=0 time=221 us starts=1 direct read=0 direct write=0 cost=5 size=3 card=1)

********************************************************************************

SQL ID: 8ggw94h7mvxd7 Plan Hash: 0

COMMIT


call     count       cpu    elapsed       disk      query    current        rows
------- ------  -------- ---------- ---------- ---------- ----------  ----------
Parse        1      0.00       0.00          0          0          0           0
Execute      1      0.00       0.00          0          0          1           0
Fetch        0      0.00       0.00          0          0          0           0
------- ------  -------- ---------- ---------- ---------- ----------  ----------
total        2      0.00       0.00          0          0          1           0

Misses in library cache during parse: 0
Parsing user id: 137     (recursive depth: 1)
********************************************************************************

SQL ID: 9v4182d6qp9ws Plan Hash: 1388734953

SELECT TO_CHAR(TO_TIMESTAMP(:1,:2),:3) 
FROM
 DUAL


call     count       cpu    elapsed       disk      query    current        rows
------- ------  -------- ---------- ---------- ---------- ----------  ----------
Parse        1      0.00       0.00          0          0          0           0
Execute      1      0.00       0.00          0          0          0           0
Fetch        1      0.00       0.00          0          0          0           1
------- ------  -------- ---------- ---------- ---------- ----------  ----------
total        3      0.00       0.00          0          0          0           1

Misses in library cache during parse: 0
Optimizer mode: ALL_ROWS
Parsing user id: 137  
Number of plan statistics captured: 1

Rows (1st) Rows (avg) Rows (max)  Row Source Operation
---------- ---------- ----------  ---------------------------------------------------
         1          1          1  FAST DUAL  (cr=0 pr=0 pw=0 time=2 us starts=1 direct read=0 direct write=0 cost=2 size=0 card=1)


Elapsed times include waiting on following events:
  Event waited on                             Times   Max. Wait  Total Waited
  ----------------------------------------   Waited  ----------  ------------
  SQL*Net message to client                       1        0.00          0.00
  SQL*Net message from client                     1        0.00          0.00
********************************************************************************

SQL ID: 4gychvvz64u9z Plan Hash: 0

INSERT INTO DATA_MANAGER.OCI_FIELD_TEST (NUMBER_COL, VARCHAR2_COL, BLOB_COL) 
VALUES
 (:1, :2, EMPTY_BLOB())


call     count       cpu    elapsed       disk      query    current        rows
------- ------  -------- ---------- ---------- ---------- ----------  ----------
Parse        1      0.00       0.00          0          0          0           0
Execute      1      0.00       0.00          0          0          4           1
Fetch        0      0.00       0.00          0          0          0           0
------- ------  -------- ---------- ---------- ---------- ----------  ----------
total        2      0.00       0.00          0          0          4           1

Misses in library cache during parse: 0
Optimizer mode: ALL_ROWS
Parsing user id: 137  
Number of plan statistics captured: 1

Rows (1st) Rows (avg) Rows (max)  Row Source Operation
---------- ---------- ----------  ---------------------------------------------------
         0          0          0  LOAD TABLE CONVENTIONAL  OCI_FIELD_TEST (cr=0 pr=0 pw=0 time=93 us starts=1 direct read=0 direct write=0)


Elapsed times include waiting on following events:
  Event waited on                             Times   Max. Wait  Total Waited
  ----------------------------------------   Waited  ----------  ------------
  SQL*Net message to client                       1        0.00          0.00
  SQL*Net message from client                     1        0.00          0.00
********************************************************************************

SQL ID: 2rys3y9bd9zbn Plan Hash: 25874125

INSERT INTO DATA_MANAGER.AUDIT_TRAIL (TABLE_NAME, RECORD_ID, FIELD_NAME, 
  ACTION_TYPE, NEW_VALUE, DATA_TYPE, CHANGED_BY, CHANGE_REASON, 
  TRANSACTION_ID, SESSION_ID, CLIENT_IP, APPLICATION_NAME, MODULE_NAME, 
  ROW_HASH) 
VALUES
 (:1, :2, :3, :4, EMPTY_CLOB(), :5, :6, :7, :8, :9, :10, :11, :12, :13)


call     count       cpu    elapsed       disk      query    current        rows
------- ------  -------- ---------- ---------- ---------- ----------  ----------
Parse        1      0.00       0.00          0          0          0           0
Execute      1      0.00       0.00          0          6          5           1
Fetch        0      0.00       0.00          0          0          0           0
------- ------  -------- ---------- ---------- ---------- ----------  ----------
total        2      0.00       0.00          0          6          5           1

Misses in library cache during parse: 0
Optimizer mode: ALL_ROWS
Parsing user id: 137  
Number of plan statistics captured: 1

Rows (1st) Rows (avg) Rows (max)  Row Source Operation
---------- ---------- ----------  ---------------------------------------------------
         0          0          0  LOAD TABLE CONVENTIONAL  AUDIT_TRAIL (cr=6 pr=0 pw=0 time=217 us starts=1 direct read=0 direct write=0)
         1          1          1   SEQUENCE  ISEQ$$_85359 (cr=0 pr=0 pw=0 time=36 us starts=1 direct read=0 direct write=0)


Elapsed times include waiting on following events:
  Event waited on                             Times   Max. Wait  Total Waited
  ----------------------------------------   Waited  ----------  ------------
  SQL*Net message to client                       1        0.00          0.00
  SQL*Net message from client                     1        0.00          0.00
********************************************************************************

SQL ID: 66f6axkjv4zha Plan Hash: 885135659

SELECT NEW_VALUE 
FROM
 DATA_MANAGER.AUDIT_TRAIL WHERE ROWID = :rid FOR UPDATE


call     count       cpu    elapsed       disk      query    current        rows
------- ------  -------- ---------- ---------- ---------- ----------  ----------
Parse        1      0.00       0.00          0          0          0           0
Execute      1      0.00       0.00          0          1          1           0
Fetch        1      0.00       0.00          0          2          0           1
------- ------  -------- ---------- ---------- ---------- ----------  ----------
total        3      0.00       0.00          0          3          1           1

Misses in library cache during parse: 0
Optimizer mode: ALL_ROWS
Parsing user id: 137  
Number of plan statistics captured: 1

Rows (1st) Rows (avg) Rows (max)  Row Source Operation
---------- ---------- ----------  ---------------------------------------------------
         1          1          1  FOR UPDATE  (cr=2 pr=0 pw=0 time=48 us starts=1 direct read=0 direct write=0)
         2          2          2   TABLE ACCESS BY USER ROWID AUDIT_TRAIL (cr=2 pr=0 pw=0 time=29 us starts=2 direct read=0 direct write=0 cost=1 size=150 card=1)


Elapsed times include waiting on following events:
  Event waited on                             Times   Max. Wait  Total Waited
  ----------------------------------------   Waited  ----------  ------------
  SQL*Net message to client                       2        0.00          0.00
  SQL*Net message from client                     2        0.00          0.00
********************************************************************************

SQL ID: 5qydpuz5rjsuf Plan Hash: 963832190

UPDATE DATA_MANAGER.OCI_FIELD_TEST SET VARCHAR2_COL=:1, DATE_COL=TO_DATE(:2,
  'YYYY-MM-DD HH24:MI:SS') 
WHERE
 NUMBER_COL=:3


call     count       cpu    elapsed       disk      query    current        rows
------- ------  -------- ---------- ---------- ---------- ----------  ----------
Parse        1      0.00       0.00          0          0          0           0
Execute      1      0.00       5.01          0        322         88          39
Fetch        0      0.00       0.00          0          0          0           0
------- ------  -------- ---------- ---------- ---------- ----------  ----------
total        2      0.00       5.01          0        322         88          39

Misses in library cache during parse: 0
Optimizer mode: ALL_ROWS
Parsing user id: 137  
Number of plan statistics captured: 1

Rows (1st) Rows (avg) Rows (max)  Row Source Operation
---------- ---------- ----------  ---------------------------------------------------
         0          0          0  UPDATE  OCI_FIELD_TEST (cr=322 pr=0 pw=57 time=5019483 us starts=1 direct read=0 direct write=0)
        39         39         39   TABLE ACCESS FULL OCI_FIELD_TEST (cr=283 pr=0 pw=0 time=284 us starts=1 direct read=0 direct write=0 cost=5 size=84 card=7)


Elapsed times include waiting on following events:
  Event waited on                             Times   Max. Wait  Total Waited
  ----------------------------------------   Waited  ----------  ------------
  enq: TX - row lock contention                   1        5.01          5.01
  buffer busy waits                               2        0.00          0.00
  SQL*Net message to client                       1        0.00          0.00
  SQL*Net message from client                     2        0.00          0.00
  SQL*Net break/reset to client                   1        0.00          0.00



********************************************************************************

OVERALL TOTALS FOR ALL NON-RECURSIVE STATEMENTS

call     count       cpu    elapsed       disk      query    current        rows
------- ------  -------- ---------- ---------- ---------- ----------  ----------
Parse       37      0.00       0.00          0          0          0           0
Execute     37      0.00       5.02          0       2686        109          48
Fetch       88      0.00       0.00          0       1673          0         384
------- ------  -------- ---------- ---------- ---------- ----------  ----------
total      162      0.01       5.03          0       4359        109         432

Misses in library cache during parse: 0

Elapsed times include waiting on following events:
  Event waited on                             Times   Max. Wait  Total Waited
  ----------------------------------------   Waited  ----------  ------------
  Allocate PGA memory from OS                     3        0.00          0.00
  SQL*Net message to client                     124        0.00          0.00
  SQL*Net message from client                   129        4.94          9.80
  Allocate UGA memory from OS                     9        0.00          0.00
  log file sync                                   2        0.00          0.00
  SQL*Net break/reset to client                   9        0.00          0.00
  buffer busy waits                               4        0.00          0.00
  SQL*Net more data from client                  55        0.00          0.00
  asynch descriptor resize                        1        0.00          0.00
  Disk file operations I/O                        2        0.00          0.00
  direct path write                              15        0.00          0.00
  enq: TX - row lock contention                   1        5.01          5.01


OVERALL TOTALS FOR ALL RECURSIVE STATEMENTS

call     count       cpu    elapsed       disk      query    current        rows
------- ------  -------- ---------- ---------- ---------- ----------  ----------
Parse       12      0.00       0.00          0          0          0           0
Execute     12      0.00       0.00          0         53          3           1
Fetch       56      0.00       0.00          0        480          0          51
------- ------  -------- ---------- ---------- ---------- ----------  ----------
total       80      0.00       0.00          0        533          3          52

Misses in library cache during parse: 0

Elapsed times include waiting on following events:
  Event waited on                             Times   Max. Wait  Total Waited
  ----------------------------------------   Waited  ----------  ------------
  Allocate UGA memory from OS                     4        0.00          0.00

   26  user  SQL statements in session.
    6  internal SQL statements in session.
   32  SQL statements in session.
********************************************************************************
Trace file: ./FREE_ora_702.trc
Trace file compatibility: 12.2.0.0
Sort options: default

       1  session in tracefile.
      26  user  SQL statements in trace file.
       6  internal SQL statements in trace file.
      32  SQL statements in trace file.
      32  unique SQL statements in trace file.
     904  lines in trace file.
      14  elapsed seconds in trace file.


